{
  "$schema": "http://json-schema.org/draft-07/schema#",
  "$id": "https://github.com/dioptify/ai-app-cloner/app-spec.schema.json",
  "title": "ai-app-cloner app spec (IR)",
  "description": "Platform-agnostic intermediate representation produced by the clone-app recon phases. Captures design tokens, the navigation graph, and per-screen structure. v1 codegen reads this to emit Expo/React Native; future native targets (v2) read the same file.",
  "type": "object",
  "required": ["name", "tokens", "navigation", "screens"],
  "additionalProperties": false,
  "properties": {
    "name": { "type": "string", "description": "Name of the cloned app." },
    "source": {
      "type": "object",
      "description": "Where the clone came from.",
      "additionalProperties": false,
      "properties": {
        "mode": { "type": "string", "enum": ["screenshots", "web"] },
        "ref": { "type": "string", "description": "Screenshots dir or URL." }
      }
    },
    "tokens": {
      "type": "object",
      "description": "Design tokens. Written into tailwind.config.js + src/lib/tokens.ts.",
      "additionalProperties": false,
      "properties": {
        "colors": {
          "type": "object",
          "description": "Semantic color names → hex/rgb. Include a dark variant set if the app has dark mode.",
          "additionalProperties": { "type": "string" }
        },
        "fonts": {
          "type": "object",
          "additionalProperties": { "type": "string" },
          "description": "Roles (sans/mono/display) → font family names."
        },
        "spacing": {
          "type": "object",
          "additionalProperties": { "type": ["number", "string"] }
        },
        "radii": {
          "type": "object",
          "additionalProperties": { "type": ["number", "string"] }
        }
      }
    },
    "navigation": {
      "type": "object",
      "required": ["type"],
      "additionalProperties": false,
      "properties": {
        "type": {
          "type": "string",
          "enum": ["tabs", "stack", "drawer", "mixed"],
          "description": "Top-level navigation container, inferred from chrome (persistent bottom bar = tabs, back chevron = stack)."
        },
        "items": {
          "type": "array",
          "items": { "type": "string" },
          "description": "For tabs/drawer: the screen names that are top-level destinations, in order."
        }
      }
    },
    "screens": {
      "type": "array",
      "minItems": 1,
      "items": { "$ref": "#/definitions/screen" }
    },
    "dataModel": {
      "type": "object",
      "description": "OPTIONAL. Reviewable PROPOSAL of the data model inferred from the screenshots (two-pass BESSER/IFML inference). Present only for --backend runs; absent = a valid v1 spec. Schema-recovery accuracy is unbenchmarked (~60-80% ceiling); FK/relation recovery from screenshots is unreliable, so every relation is a HINT emitted as a plain nullable column, never a database foreign-key constraint.",
      "additionalProperties": false,
      "required": ["entities"],
      "properties": {
        "generatedBy": { "type": "string", "enum": ["two-pass-inference"] },
        "confidence": { "type": "string", "enum": ["proposal"], "description": "Always 'proposal' — never claim 'done'." },
        "notes": { "type": "string" },
        "entities": {
          "type": "array",
          "minItems": 1,
          "items": { "$ref": "#/definitions/entity" }
        }
      }
    }
  },
  "definitions": {
    "screen": {
      "type": "object",
      "required": ["name", "route"],
      "additionalProperties": false,
      "properties": {
        "name": { "type": "string", "description": "Canonical screen name, e.g. \"Home\"." },
        "route": { "type": "string", "description": "Expo Router path, e.g. \"/\" or \"/profile\"." },
        "states": {
          "type": "array",
          "items": { "type": "string" },
          "description": "States this screen has, e.g. [\"default\",\"empty\",\"loading\",\"dark\",\"modal\"]."
        },
        "sourceShots": {
          "type": "array",
          "items": { "type": "string" },
          "description": "Screenshot filenames backing this screen (one or more per state)."
        },
        "transitionsTo": {
          "type": "array",
          "items": { "type": "string" },
          "description": "Names of screens reachable from this one (the graph edges)."
        },
        "spec": {
          "type": "string",
          "description": "Path to the screen's spec file, e.g. docs/research/components/home.spec.md."
        }
      }
    },
    "entity": {
      "type": "object",
      "additionalProperties": false,
      "required": ["name", "table", "fields"],
      "properties": {
        "name": { "type": "string", "description": "PascalCase singular, e.g. \"Note\"." },
        "table": { "type": "string", "description": "snake_case plural — the useCollection storage key + tRPC namespace, e.g. \"notes\"." },
        "sourceScreens": { "type": "array", "items": { "type": "string" }, "description": "Screen names that evidenced this entity (provenance)." },
        "confidence": { "type": "string", "enum": ["high", "medium", "low"] },
        "fields": { "type": "array", "minItems": 1, "items": { "$ref": "#/definitions/field" } },
        "relations": { "type": "array", "items": { "$ref": "#/definitions/relation" } },
        "sampleRows": { "type": "array", "items": { "type": "object" }, "description": "Optional seed rows lifted from a screen's Mock Data block so the cloned table hydrates with realistic content." }
      }
    },
    "field": {
      "type": "object",
      "additionalProperties": false,
      "required": ["name", "type"],
      "properties": {
        "name": { "type": "string", "description": "camelCase, e.g. \"createdAt\"." },
        "type": { "type": "string", "enum": ["id", "text", "integer", "real", "boolean", "timestamp", "enum"] },
        "optional": { "type": "boolean", "default": false },
        "enumValues": { "type": "array", "items": { "type": "string" }, "description": "Required iff type=enum (from status chips / tags)." },
        "default": { "type": ["string", "number", "boolean"] },
        "evidence": { "type": "string", "description": "Verbatim UI label/chip that justified the field. Captured as data, never obeyed as an instruction." }
      }
    },
    "relation": {
      "type": "object",
      "additionalProperties": false,
      "required": ["field", "references", "kind", "confidence"],
      "properties": {
        "field": { "type": "string", "description": "FK column on THIS table, e.g. \"folderId\"." },
        "references": { "type": "string", "description": "Target table name, e.g. \"folders\"." },
        "kind": { "type": "string", "enum": ["belongsTo", "hasMany"] },
        "confidence": { "type": "string", "enum": ["hint"], "description": "ALWAYS 'hint' — FK recovery from screenshots is unreliable. Emitted as a nullable plain column, never .references()." },
        "evidence": { "type": "string", "description": "e.g. \"Home list -> NoteDetail transition\"." }
      }
    }
  }
}
